"What can you catch but not throw?",Cold
"Black we are and much admired. Men seek us if they are tired. We tire the horse, comfort man. Guess this riddle if you can.",Coal
"I have a face, yet no senses. But I don't really care, because time is of the essence.",Clock
"If you have it, you want to share it. If you share it, you don't have it.",Secret
"There is one in every corner and two in every room.",O
"It comes only before, it comes only after. Rises only in darkness, but rises only in light. It is always the same, but is yet always different.",Moon
"As soft as silk, as white as milk, as bitter as gall, a thick green wall, and a green coat covers me all.",Walnut
"Three little letters. A paradox to some. The worse that it is, the better it becomes.",Pun
"Almost everyone needs it, asks for it, gives it. But almost nobody takes it.",Advice
"Different lights do make me strange, thus into different sizes I will change.",Pupil
"Ten men's strength, ten men's length. Ten men can't break it, yet a young boy walks off with it.",Rope
"Some try to hide, some try to cheat. But time will show, we always will meet. Try as you might, to guess my name. I promise you'll know, when you I do claim.",Death
"I'm a god. I'm a planet. I measure heat.",Mercury
"I'm white, I'm round, but not always around. Sometimes you see me, sometimes you don't.",Moon
"People are hired to get rid of me. I'm often hiding under your bed. In time I'll always return you see. Bite me and you're surely dead.",Dust
"Die without me, never thank me. Walk right through me, never feel me. Always watching, never speaking. Always lurking, never seen.",Air
"White bird, featherless, flying out of paradise. Flying over sea and land. Dying in my hand.",Snow
"My life can be measured in hours. I serve by being devoured. Thin, I am quick. Fat, I am slow. Wind is my foe.",Candle
"What goes up but never comes down?",Age
"We are all around, yet to us you are half blind. Sunlight makes us invisible, and difficult to find.",Stars
"What's large on Saturday and Sunday. Small on Tuesday, Wednesday, and Thursday, and disappears on Monday and Friday?",S
"What do you fill with empty hands?",Gloves
"Goes over all the hills and hollows. Bites hard, but never swallows.",Frost
"A red drum which sounds without being touched, and grows silent, when it is touched.",Heart
"My second is performed by my first, and it is thought a thief by the marks of my whole might be caught.",Footstep
"The man who made it didn't need it. The man who bought it didn't use it. The man who used it didn't want it.",Coffin
"A hill full, a hole full, yet you cannot catch a bowl full.",Mist
"I am a box that holds black and white keys without locks. Yet they can unlock your soul.",Piano
"What is often returned, but never borrowed/",Thanks
"What word has kst in the middle, in the beginning, and at the end?",Inkstand
"So cold, damp and dark this place. To stay you would refrain, yet those who occupy this place do never complain.",Grave
"What kind of nut is empty at the center and has no shell.",Doughnut
"I have a title and many pages. I am a genteel of genteel descent. I am a killer veteran of war. I am a slave to my lord pledged to his service.",Knight
"Of these things - I have two. One for me - and one for you. And when you ask about the price, I simply smile and nod twice.",Sharing
"At night I come without being fetched. By day I am lost without being stolen.",Stars
"Ripped from my mother's womb. Beaten and burned, I become a blood thirsty killer.",Iron
"I'm very tempting, so its said, I have a shiny coat of red, and my flesh is white beneath. I smell so sweet, taste good to eat, and help to guard your teeth.",Apple
"They made me a mouth, but didn't give me breath. Water gives me life, but the sun brings me death.",Snowman
"We are five little objects of an everyday sort. You will find us all in a tennis court.",Vowels
"What always runs but never walks, often murmurs, never talks. Has a bed but never sleeps, has a mouth but never eats?",River
"I can be cracked, I can be made. I can be told, I can be played.",Joke
"My children are near and far. No matter that I know where they are. The gift I give them make their day. But if I were gone they would wander away.",Sun
"Screaming, soaring seeking sky. Flowers of fire flying high. Eastern art from ancient time. Name me now and solve this rhyme.",Firework
"Who is it that rows quickly with four oars, but never comes out from under his own roof?",Turtle
"Who works when he plays and plays when he works?",Musician
"My first is twice in apple but not once in tart. My second is in liver but not in heart. My third is in giant and also in ghost. Whole I'm best when I am toast.",Pig
"Reaching stiffly for the sky, I bare my fingers when its cold. In warmth I wear an emerald glove and in between I dress in gold.",Tree
"What has a single eye but cannot see?",A needle
"I'm light as a feather, yet the strongest man can't hold me for more than 5 minutes. What am I?",Breath.
"What goes in the water black and comes out red?",A lobster.
"What two things can you never eat for breakfast?",Lunch and dinner.
"What is brown and sticky?",A stick.
"What asks but never answers?",An owl
"What loses its head in the morning and gets it back at night?",A pillow
"What building has the most stories?",A library.
"I occur once in a minute...",The letter 'm'
"What is the difference between a grandmother and a granary?",One is one's born-kin, the other is one's corn-bin
"I pass before the sun, but make no shadow. What am I?",Wind
"Lighter than a feather, but a man cannot hold me for long...",Breath
"I have a hundred legs and cannot stand, a long neck but no head, and I eat the maid's life.",Broom
