"With thieves I consort, With the Vilest, in short, I am quite at ease in depravity, Yet all divines use me, And savants can't lose me, For I am the century of gravity.",V
"I move without wings, Between silken string, I leave as you find, My substance behind.",Spider
"What flies forever, Rests never?",Wind
"I crawl on the earth. And rise on a pillar.",Shadow
"They are many and one, they wave and they drum, Used to cover a state, they go with you everywhere.",Hands
"I have holes on the top and bottom. I have holes on my left and on my right. And I have holes in the middle, Yet I still hold water.",Sponge
"What can be swallowed, But can also swallow you?",Pride
"I run around the city, but I never move.",Wall
"Two horses, swiftest traveling, harnessed in a pair, and grazing ever in places. Distant from them.",Eyes
"At the sound of me, men may dream. Or stamp their feet. At the sound of me, women may laugh. Or sometimes weep.",Music
"To unravel me you need a simple key, no key that was made by locksmith's hand. But a key that only I will understand.",Riddle
"Long and think, red within, with a nail at the end.",Finger
"I'm sometimes white and always wrong. I can break a heart and hurt the strong. I can build love or tear it down. I can make a smile or bring a frown.",Lie
"I come in winter. I cannot see, hear, or feel. I can't eat, But you can eat parts of me.",Snowman
"Sometimes I am loud. And viewed with distaste. Poke out my 'eye', then I'm on the front of your face.",Noise
"What is it that has four legs, one head, and a foot?",Bed
"What makes a loud noise when changing its jacket. Becomes larger but weighs less?",Popcorn
"I am always hungry, I must always be fed. The finger I lick will soon turn red.",Fire
"Something wholly unreal, yet seems real to I. Think my friend, tell me where does it lie?",Mind
"No matter how little or how much you use me, you change me every month.",Calendar
"What can burn the eyes, sting the mouth, yet be consumed?",Salt
"What an fill a room but takes up no space?",Light
"It occurs once in every minute. Twice in every moment and yet never in one hundred thousand years.",M
"With pointed fangs it sits in wait. With piercing force it doles out fate, over bloodless victims proclaiming its might. Eternally joining in a single bite.",Stapler
"I have a hundred legs, but cannot stand. I have a long neck, but no head. I cannot see. I'm neat and tidy as can be.",Broom
"Flat as a leaf, round as a ring. Has two eyes, can't see a thing.",Button
"I don't think or eat or slumber. Or move around or fear thunder. Just like you I look the same but I can't harm you or be your bane.",Doll
"What is it that you must give before you can keep it.",Word
"What is long and slim, works in light. Has but one eye, and an awful bite?",Needle
"What lies in a tunnel of darkness. That can only attack when pulled back?",Bullet
"What has six faces and twenty-one eyes?",Die
"Until I am measured. I am not known, yet how you miss me when I have flown.",Time
"Three lives have I. Gentle enough to soothe the skin. Light enough to caress the sky. Hard enough to crack rocks.",Water
"I wear a red robe, with staff in hand, and a stone in my throat.",Cherry
"A warrior amongst the flowers, he bears a thrusting sword. He uses it whenever he must, to defend his golden hoard.",Bee
"I hide but my head is outside.",Nail
"A house full, a yard full, a chimney full, no one can get a spoonful.",Smoke
"You can spin, wheel and twist. But this thing can turn without moving.",Milk
"Halo of water, tongue of wood. Skin of stone, long I've stood. My fingers short reach to the sky. Inside my heart men live and die.",Castle
"When they are caught, they are thrown away. When they escape, you itch all day.",Fleas
"In we go, out we go. All around and in a row. Always, always steady flow. When we'll stop, you'll never known. In we go, out we go.",Tides
"Born of earth, but with none of its strength. Molded by flame, but with none of its power. Shaped",Glass
"Remove the outside. Cook the inside. Eat the outside. Throw away the inside.",Corn
"This is in a realm of true and in a realm false, but you experience me as you turn and toss.",Dream
"There is an ancient invention. Still used in some parts of the world today. That allows people to see through walls.",Window
"Metal or bone I may be, many teeth I have and always bared. Yet my bite harms no one. And ladies delight in my touch.",Comb
"I am a fire's best friend. When fat, my body fills with wind. When pushed to thin, through my nose I blow. Then you can watch the embers glow.",Bellows
"You heart it speak, for it has a hard tongue. But it cannot breathe, for it has not a lung.",Bell
"The eight of us move forth and back. To protect our king from the foes attack.",Pawns
"He has one and a person has two. A citizen has three. And a human being has four. A personality has five. And an inhabitant of earth has six.",Syllable
"If you break me, I do not stop working. If you touch me, I may be snared. If you lose me, nothing will matter.",Heart
"What's in the middle of nowhere?",H
"What force and strength cannot get through. I, with a gentle touch, can do. Many in the street would stand. Were I not a friend at hand.",Key
"Often held but never touched. Always wet but never rusts. Often bits but seldom bit. To use it well you must have wit.",Tongue
"As round as an apple. As deep as a cup. All the king's horses can't pull it up.",Well
"He stands beside the road. In a purple cap at tattered green cloak. Those who touch him, curse him.",Thistle
"Power enough to smash ships and crush roofs. Yet it still must fear the sun.",Ice
"What surrounds the world, yet dwells within a thimble?",Space
"I cannot be other than what I am, until the man who made me dies. Power and glory will fall to me finally. Only when he last closes his eyes.",Prince
"What is it that makes tears without sorrow. And takes its journey to heaven?",Smoke
"Inside a great blue castle lives a shy young maid. She blushes in the morning and comes not out at night.",Sun
"This thing runs but cannot walk, sometimes sings but never talks. Lacks arms, has hands; lacks a head but has a face.",Clock
"A word I know, six letters it contains. Subtract just one and twelve remains.",Dozens
"I am the yellow hem of the sea's blue skirt.",Beach
"A skin have I, more eyes than one. I can be very nice when I am done.",Potato
"I have four legs but no tail. Usually I am heard only at night.",Frog
"A tiny bead, like fragile glass, strung along a cord of grass.",Dew
"Break it and it is better, immediately set and harder to break again.",Record
"Each morning I appear to lie at your feet, all day I follow no matter how fast you run. Yet I nearly perish in the midday sun.",Shadow
"What do you throw out to use and take in when you're done?",Anchor
"A seed am I, three letters make my name. Take away two and I still sound the same.",Pea
"In the middle of night, I surround the gong. In the middle of sight, I end the song.",G
"Look into my face and I'm everybody. Scratch my back and I'm nobody.",Mirror
"Two brothers we are, great burdens we bear. All day we are bitterly pressed. Yet this I will say, we are full all the day, and empty when go to rest.",Boots
"What is it that was given to you, belongs only to you. And yet your friends use it more than you do?",Name
"By Moon or by Sun, I shall be found. Yet I am undone, if there's no light around.",Shadow
"What do you use to hoe a row, slay a foe, and wring with woe?",Hands
"We travel much, yet prisoners are, and close confined to boot. Yet with any horse, we will keep the pace, and will always go on foot.",Spurs
"Without a bridle, or a saddle, across a thing I ride a-straddle. And those I ride, by help of me, though almost blind, are made to see.",Glasses
"I fly through the air on small feathered wings, seeking out life and destroying all things.",Arrow
"I am the red tongue of the earth, that buries cities.",Lava
"I look at you, you look at me, I raise my right, you raise your left.",Mirror
"What is the thing which, once poured out, cannot be gathered again?",Rain
"It is a part of us, and then replaced. It escapes out bodies, to a better place. The world becomes its sizeable home. Its passions unrestraint, the planet it roams.",Water
"What word starts with 'E', ends with 'E', but only has one letter? It is not the letter 'E'.",Envelope
"A hole in a pole, though I fill a hole in white. I'm used more by the day, and less by the night.",Eye
"I fly, yet I have no wings. I cry, yet I have no eyes. Darkness follows me. Lower light I never see.",Cloud
"I'm full of holes, yet I'm full of water.",Sponge
"Long and slinky like a trout, never sings till it's guts come out.",Gun
"What animal keeps the best time?",Watchdog
"What kind of room has no windows or doors?",Mushroom
"I have legs but walk not, a strong back but work not. Two good arms but reach not. A seat but sit and tarry not.",Chair
"It's in your hand though you can not feel it. Only you and time can reveal it.",Fate
"Not born, but from a Mother's body drawn. I hang until half of me is gone. I sleep in a cave until I grow old. Then valued for my hardened gold.",Cheese
"I am the outstretched fingers that seize and hold the wind. Wisdom flows from me in other hands. Upon me are sweet dreams dreamt, my merest touch brings laughter.",Feather
"Hands she has but does not hold. Teeth she has but does not bite. Feet she has but they are cold. Eyes she has but without sight.",Doll
"Only two backbones and thousands of ribs.",Railroad
"Hard iron on horse. Cow's hide on man.",Shoe
"What word is the same written forward, backward and upside down?",Noon
"I cannot be felt, seen or touched. Yet I can be found in everybody. My existence is always in debate. Yet I have my own style of music.",Soul
"I am seen in the water. If seen in the sky, I am in the rainbow, a jay's feather, and lapis lazuli.",Blue
"You use it between your head and your toes, the more it works the thinner it grows.",Soap
"Fatherless and motherless. Born without sin, roared when it came into the world. And never spoke again.",Thunder
"Where can you find roads without cars, forests without trees and cities without houses?",Map
"A leathery snake, with a stinging bite. I'll stay coiled up, unless I must fight.",Whip
"Take one out and scratch my head, I am now black but once was red.",Match
"Mountains will crumble and temples will fall. And no man can survive its endless call.",Time
"I'm the source of all emotion, but I'm caged in a white prison.",Heart
"I am the tool, for inspiring many. Buy me in the store, for not much more than a penny. Don't overuse me, or my usefulness will go.",Pen
"What goes through a door but never goes in. And never comes out?",Keyhole
"What goes up when the rain comes down?",Umbrella
"I occur twice in eternity. And I'm always within sight.",T
"Twigs and spheres and poles and plates. Join and bind to reason make.",Skeleton
"The sun bakes them, the hand breaks them, the foot treads on them, and the mouth tastes them.",Grapes
"What's black when you get it, red when you use it, and white when you're all through with it?",Charcoal
"What has four legs in the morning, two legs in the afternoon, and three legs in the evening?",Man
"Take off my skin, I won't cry, but you will.",Onion
"Hold the tail, while I fish for you.",Net
"I am so simple that I can only point. Yet I guide men all over the world.",Compass
"Iron roof, glass walls, burns and burns and never falls.",Lantern
"Late afternoons I often bathe. I'll soak in water piping hot. My essence goes through. My see through clothes. Used up am I - I've gone to pot.",Teabag
"What can't you see, hear or feel, until its too late. What shadows love, and shopkeepers hate?",Thief
"What can bring back the dead. Make us cry, make us laugh, make us young. Born in an instant yet lasts a life time?",Memory
"I have a neck but no head. I have a body but no arm. I have a bottom but no leg.",Bottle
"Gold in a leather bag, swinging on a tree, money after honey in its time. Ills of a scurvy crew cured by the sea, reason in its season but no rhyme.",Orange
"A slow, solemn square-dance of warriors feinting. One by one they fall, warriors fainting, thirty-two on sixty-four.",Chess
"He has married many women but has never married.",Priest
"In your fire you hear me scream, creaking and whining, yet I am dead before you lay me in your hearth.",Log
"Large as a mountain, small as a pea, endlessly swimming in a waterless sea.",Asteroid
"Give it food and it will live, give it water and it will die.",Fire
"A nut cracker up in a tree.",Squirrel
"What happens every second, minute, month, and century. But not every hour, week, year, or decade?",N
"It has no top or bottom, but it can hold flesh, bones, and blood all at the same time.",Ring
"I am free for the taking. Through all of your life, though given but once at birth. I am less than nothing in weight, but will fell the strongest of you if held.",Breath
"When I'm metal or wood, I help you get home. When I'm flesh and I'm blood. In the darkness I roam.",Bat
"Tool of thief, toy of queen. Always used to be unseen. Sign of joy, sign of sorrow. Giving all likeness borrowed.",Mask
"What five-letter word becomes shorter when you add two more letters?",Short
"What is pronounced like one letter, written with three letters. And belongs to all animals?",Eye
"What is it that given one, you'll have either two or none?",Choice
"It is greater than God and more evil than the devil. The poor have it, the rich need it, and if you eat it you'll die.",Nothing
"What gets bigger the more you take away from it?",Hole
"The more of it there is, the less you see.",Darkness
"To cross the water I'm the way, for water I'm above. I touch it not and, truth to say, I neither swim nor move.",Bridge
"As beautiful as the setting sun, as delicate as the morning dew. An angel's dusting from the stars. That can turn the Earth into a frosted moon.",Snow
"When set loose I fly away. Never so cursed as when I go astray.",Fart
"How far will a blind dog walk into a forest?",Halfway
"Face with a tree, skin like the sea. A great beast I am. Yet vermin frightens me.",Elephant
"I sleep by day, I fly by night. I have no feathers to aid my flight.",Bat
"I am mother and father, but never birth or nurse. I'm rarely still, but I never wander.",Tree
"What goes in the water red, and comes out black?",Iron
"Grows from the ground, bushes and grass, leaves of yellow, red and brow, unruly plants, get the axe, trim the hedge back down.",Hair
"What can touch someone once and last them a life time?",Love
"A dragons tooth in a mortals hand, I kill, I maim, I divide the land.",Sword
"No sooner spoken than broken.",Silence
"Though desert men once called me God, today men call me mad. For I wag my tail when I am angry. And growl when I am glad.",Cat
"An open ended barrel, it is shaped like a hive. It is filled with the flesh, and the flesh is alive.",Thimble
"What kind of pet always stays on the floor?",Carpet
"What flies without wings? What passes all things? What mends all sorrow? What brings the morrow?",Time
"What has a neck and no head, two arms but no hands?",Shirt
"Two in a corner, one in a room, none in a house, but one in a shelter.",R
"What does no man want, yet no man want to lose?",Work
"I am the heart that does not beat. If cut, I bleed without blood. I can fly, but have no wings. I can float, but have no fins. I can sing, but have no mouth.",Wood
"Weight in my belly, trees on my back, nails in my ribs, feet I do lack.",Boat
"What is that over the head and under the hat?",Hair
"I bind it and it walks. I loose it and it stops.",Sandal
"My voice is tender, my waist is slender and I'm often invited to play. Yet wherever I go, I must take my bow or else I have nothing to say.",Violin
"Lovely and round, I shine with pale light, grown in the darkness, a lady's delight.",Pearl
"The strangest creature you'll ever find has two eyes in front and a hundred behind.",Peacock
"A little pool with two layers of wall around it. One white and soft and the other dark and hard. Amidst a light brown grassy lawn with an outline of a green grass.",Coconut
"I open wide and tight I shut, Sharp am I and paper-cut fingers too, so do take care, I'm good and bad, so best beware.",Scissors
"Only one color, but not one size. Stuck at the bottom, yet easily flies. Present in sun, but not in rain. Doing no harm, and feeling no pain.",Shadow
"A house of wood in a hidden place. Built without nails or glue. High above the earthen ground. It holds pale gems of blue.",Nest
"Who spends the day at the window, goes to the table for meals. And hides at night?",Fly
"The beginning of eternity, the end of time and space, the beginning of every end, the end of every place.",E
"Always old, sometimes new. Never sad, sometimes blue. Never empty, sometimes full. Never pushes, always pulls.",Moon
"I bubble and laugh and spit water in your face. I am no lady, and I don't wear lace.",Fountain
"My teeth are sharp, my back is straight, to cut things up it is my fate.",Saw
"I love to dance and twist and prance. I shake my tail, as away I sail. Wingless I fly into the sky.",Kite
"I usually wear a yellow coat. I usually have a dark head. I make marks wherever I go.",Pencil
"My life is often a volume of grief, your help is needed to turn a new leaf. Stiff is my spine and my body is pale. But I'm always ready to tell a tale.",Book
"I cost no money to use, or conscious effort to take part of. And as far as you can see, there is nothing to me. But without me, you are dead.",Air
"Soldiers line up spaced with pride. Two long rows lined side by side. One sole unit can decide, if the rows will unit or divide.",Zipper
"What measures out time. Until in time all is smashed to it?",Sand
"I turn around once. What is out will not get in. I turn around again. What is in will not get out.",Key
"Who is he that runs without a leg. And his house on his back?",Snail
"What has roots as nobody sees, is taller than trees. Up, up it goes, and yet never grows?",Mountain
"Come up and let us go. Go down and here we stay.",Anchor
"They have not flesh, nor feathers, nor scales, nor bone. Yet they have fingers and thumbs of their own.",Gloves
"Long slim and slender. Dark as homemade thunder. Keen eyes and peaked nose. Scares the Devil wherever it goes.",Snake
"What is put on a table, cut, but never eaten?",Deck
"The sharp slim blade, that cuts the wind.",Grass
"Although my cow is dead, I still beat her What a racket she makes.",Drum
"I have four wings but cannot fly. I never laugh and never cry. On the same spot always found, toiling away with little sound.",Windmill
"All about the house, with his lady he dances, yet he always works, and never romances.",Broom
"I walked and walked and at last I got it. I didn't want it. So I stopped and looked for it. When I found it, I threw it away.",Thorn
"Two in a whole and four in a pair. And six in a trio you see. And eight's a quartet but what you must get. Is the name that fits just one of me?",Half
"I drive men mad for love of me. Easily beaten, never free.",Gold
"I go around in circles, but always straight ahead. Never complain, no matter where I am led.",Wheel
"You use a knife to slice my head. And weep beside me when I am dead.",Onion
"Turns us on our backs, and open up our stomachs. You will be the wisest of men though at start a lummox.",Books
"Thousands lay up gold within this house. But no man made it. Spears past counting guard this house, but no man wards it.",Beehive
"What goes around the world and stays in a corner?",Stamp
"What has to be broken before it can be used?",Egg
"Double my number, I'm less than a score. Half of my number is less than four. Add one to my double when bakers are near. Days of the week are still greater, I fear.",Six
"In buckles or lace, they help set the pace. The farther you go, the thinner they grow.",Shoes
"When young, I am sweet in the sun. When middle-aged, I make you gay. When old, I am valued more than ever.",Wine
"Forward I'm heavy, but backwards I'm not.",Ton
"Hard to catch, easy to hold. Can't be seen, unless it's cold.",Breath
"Two little holes in the side of a hill. Just as you come to the cherry-red mill.",Nose
"When you stop and look, you can always see me. If you try to touch, you cannot feel me. I cannot move, but as you near me, I will move away from you.",Horizon
"A dagger thrust at my own heart, dictates the way I'm swayed. Left I stand, and right I yield, to the twisting of the blade.",Lock
"What instrument can make any sound and be heart, but not touched or seen?",Voice
"What goes further the slower it goes?",Money
"I can run but not walk. Wherever I go, thought follows close behind.",Nose
"Used left or right, I get to travel over cobblestone or gravel. Used up, I vie for sweet success, used down, I cause men great duress.",Thumb
"What goes through the door without pinching itself? What sits on the stove without burning itself? What sits on the table and is not ashamed?",Sun
"The moon is my father. The sea is my mother. I have a million brothers. I die when I reach land.",Wave
"What always goes to bed with his shoes on?",Horse
"My thunder comes before the lightning. My lightning comes before the clouds. My rain dries all the land it touches.",Volcano
"My love, when I gaze on thy beautiful face. Careering along, yet always in place, the thought has often come into my mind. If I ever shall see thy glorious behind.",Moon
"What starts with a 'T', ends with a 'T', and has T in it?",Teapot
"Today he is there to trip you up. And he will torture you tomorrow. Yet he is also there to ease the pain, when you are lost in grief and sorrow.",Alcohol
"Inside a burning house, this thing is best to make. And best to make it quickly, before the fire's too much to take.",Haste
"What is round as a dishpan, deep as a tub, and still the oceans couldn't fill it up?",Sieve
"Gets rid of bad ones, short and tall. Tightens when used, one size fits all.",Noose
"What gets wetter the more it dries.",Towel
"A little house full of meat, no door to go in and eat.",Nut
"A beggar's brother went out to sea and drowned. But the man who drowned had no brother. Who was the beggar to the man who drowned?",Sister
"I can be written, I can be spoken, I can be exposed, I can be broken.",News
"Tall in the morning, short at noon, gone at night. But I'll be back soon.",Shadow
"In the night a mountain, in the morning a meadow.",Bed
"What can be heard and caught but never seen?",Remark
"If a man carried my burden, he would break his back. I am not rich, but leave silver in my track.",Snail
"High born, my touch is gentle. Purest white is my lace. Silence is my kingdom. Green is the color of my death.",Snow
"You heard me before, yet you hear me again, then I die. Until you call me again.",Echo
"What wears a coat in the winter and pants in the summer?",Dog
"I'm not really more than holes tied to more holes. I'm strong as good steel, though not as stiff as a pole.",Chain
"Up on high I wave away but not a word can I say.",Flag
"I am whole but incomplete. I have no eyes, yet I see. You can see, and see right through me. My largest part is one fourth of what I once was.",Skeleton
"They're up near the sky, on something very tall. Sometimes they die, only then do they fall.",Leaves
"Toss me out of the window. You'll find a grieving wife. Pull me back but through the door, and watch someone give life.",N
"I build up castles. I tear down mountains. I make some men blind. I help others to see.",Sand
"Round as a button, deep as a well. If you want me to talk, you must first pull my tail.",Bell
"A house with two occupants, sometimes one, rarely three. Break the walls, eat the boarders, then throw away me.",Peanut
"I have one eye. See near and far. I hold the moments you treasure and the things that make you weep.",Camera
"There are two meanings to me. With one I may need to be broken, with the other I hold on. My favorite characteristic is my charming dimple.",Tie
"With sharp edged wit and pointed poise. It can settle disputes without making a noise.",Sword
"Lighter than what I am made of, more of me is hidden than is seen. I am the bane of the mariner. A tooth within the sea.",Iceberg
"I have one, you have one. If you remove the first letter, a bit remains. If you remove the second, bit still remains. If you remove the third, it still remains.",Habit
"Kings and queens may cling to power. And the jester's got his call. But, as you may all discover. The common one outranks them all.",Ace
"Glittering points that downward thrust. Sparkling spears that never rust.",Icicles
"What I am filled, I can point the way. When I am empty. Nothing moves me. I have two skins. One without and one within.",Gloves
"If you drop me I'm sure to crack. But give me a smile and I'll always smile back.",Mirror
"I make you weak at the worst of all times. I keep you safe, I keep you fine. I make your hands sweat. And your heart grow cold. I visit the weak, but seldom the bold.",Fear
"I run through hills. I veer around mountains. I leap over rivers. And crawl through the forests. Step out your door to find me.",Road
"You can see nothing else when you look in my face. I will look you in the eye and I will never lie.",Mirror
"I have split the one into five. I am the circle that few will spy. I am the path that breaks and gives. I am the bow no man may bend.",Rainbow
"Snake coiled round and round. Snake deep below the ground. Snake that's never had a head. Snake that binds but not with dread.",Rope
"My first is in ocean but never in sea. My second's in wasp but never in bee. My third is in glider and also in flight. My whole is a creature that comes out at night.",Owl
"Dies half its life. Lives the rest. Dances without music. Breathes without breath.",Tree
"What runs around all day. Then lies under the bed. With its tongue hanging out?",Shoe
"You must keep this thing. Its loss will affect your brothers. For once yours is lost, it will soon be lost by others.",Temper
